### ISSUE TITLE
DHCPv4: accept relayed requests (FreeBSD unicast listen missing)

### ISSUE THREAD

**Issue by mack42** [ZerosAndOnesLLC/rDHCP#57]
## Summary

rdhcpd on FreeBSD only receives DHCP broadcasts — it silently drops relayed DHCP requests sent as unicast to its listen IP. End-to-end: a Juniper EX2300 relaying VLAN 42 DHCPDISCOVERs to 172.29.69.1 reaches the host NIC but is never processed.

## Evidence

**tcpdump on aifw vtnet1** — relayed DHCP arriving:
\`\`\`
00:11:17.030703 IP 172.29.42.1.67 > 172.29.69.1.67: BOOTP/DHCP, Request from bc:24:11:a7:4a:2b
00:11:24.759642 IP 172.29.42.1.67 > 172.29.69.1.67: BOOTP/DHCP, Request from bc:24:11:a7:4a:2b
00:11:27.018387 IP 172.29.42.1.67 > 172.29.69.1.67: BOOTP/DHCP, Request from bc:24:11:a7:4a:2b
\`\`\`

**rdhcpd log** — startup shows only broadcast socket:
\`\`\`
INFO rdhcpd::dhcpv4::server: DHCPv4 server listening addr=255.255.255.255:67
\`\`\`
No subsequent \"received DHCPv4 Discover\" log lines for the VM MAC, even though the packets hit the NIC.

**Juniper EX2300 relay stats** — request forwarded, reply never arrives:
\`\`\`
Messages received: DHCPDISCOVER 25, DHCPREQUEST 5
Messages sent:     DHCPOFFER 0, DHCPACK 0
Binding: bc:24:11:a7:4a:2b  SELECTING  irb.42
\`\`\`

## Root cause

\`src/main.rs\` (lines 323–346) binds the recv socket to \`255.255.255.255:67\` with \`IP_BINDANY\` on FreeBSD. That socket receives **only** link-layer broadcasts; unicast packets destined to the host's own IPs go to a different kernel demultiplexing path and never reach this socket.

Linux-flavored \`0.0.0.0:67\` catches both, but on FreeBSD \`0.0.0.0:67\` explicitly does **not** catch broadcasts — which is why the current code uses the explicit 255.255.255.255 bind. The server therefore works for directly-connected clients but is invisible to any upstream DHCP relay.

The packet-handling code already has relay-aware logic (\`packet.is_relayed()\`, \`scope_for(giaddr)\` in \`server.rs:688\`, reply routing via \`is_known_relay\` at \`server.rs:882\`) — the missing piece is the socket never receives the packet in the first place.

## Proposed fix

Listen on **both** the broadcast address and each server-local unicast IP. Candidate approaches, listed by preference:

1. **Dual-socket** (simplest, FreeBSD-compatible): open one \`255.255.255.255:67\` socket as today, plus one additional \`0.0.0.0:67\` socket via \`SO_REUSEPORT\` for unicast. Both feed the same worker queue. No changes to the packet handler.

2. **Per-interface unicast sockets**: bind explicitly to each interface IP configured in \`[[subnet]]\` for relay-target behavior. More precise but requires tracking interface changes for \`SIGHUP\` reload.

3. **Raw/divert socket**: use BPF on receive like we do on send. Highest flexibility but more attack surface and more complex teardown.

Option 1 is the minimum viable fix.

## Security considerations

Accepting unicast DHCP widens the input surface. Mitigations to include in the same change:

- **Trusted relay agent whitelist** (per-subnet): \`trusted_relays = [\"172.29.69.5\"]\`. When a packet arrives with \`giaddr != 0\`, require the UDP source IP to match an entry in the scope's whitelist before further processing. Drop silently + metric increment on mismatch.
- **giaddr/source IP sanity**: \`giaddr\` MUST be within the network of a configured \`[[subnet]]\`. Reject if not (prevents a rogue relay from claiming an arbitrary scope).
- **Bogon/martian check**: reject relayed packets whose \`giaddr\` is in loopback / link-local / multicast / reserved ranges.
- **Hop-count already bounded** (\`MAX_HOPS = 32\` in \`server.rs:44\`) — keep.
- **Rate limiting per relay agent source IP** in addition to the existing per-MAC limiter, so one misbehaving relay can't exhaust the global budget.
- **Metrics** for observability: \`dhcpv4_relayed_received_total\`, \`dhcpv4_relayed_dropped_untrusted_relay_total\`, \`dhcpv4_relayed_dropped_bad_giaddr_total\`.
- **Do not** trust Option 82 (relay agent info) sub-options for client identity without explicit opt-in config — it's relay-provided and therefore untrustworthy unless the relay itself is trusted AND its interface/circuit IDs are meaningful to the operator.

## Performance considerations

- \`SO_REUSEPORT\` already in use on the broadcast socket → the second socket slots in cleanly without changing the worker model.
- Keep the hot path allocation-free: scope lookup by giaddr uses the existing \`SubnetInfo\` arc slice; no new per-packet allocations.
- Reply path for relayed packets already avoids BPF (uses UDP unicast to \`giaddr:67\`) per \`server.rs:899–901\`. That's correct — don't regress to BPF for relayed replies.
- Bench before/after with \`bench/run.sh\` including a relayed-DHCP workload (perfdhcp \`-g\` flag to simulate giaddr). Goal: no measurable regression in direct-broadcast DORA throughput.

## Config schema additions

\`\`\`toml
[global]
# Global kill-switch for relay acceptance. Default: true.
# If false, packets with giaddr != 0 are dropped unconditionally.
accept_relayed = true

[[subnet]]
network = \"172.29.42.0/24\"
# Optional — only accept relayed DHCP from these source IPs
# If empty/missing and accept_relayed = true, all relays permitted
# (backwards-compatible with operators who don't want the whitelist).
trusted_relays = [\"172.29.69.5\"]
\`\`\`

## UI integration (AiFw — tracked separately)

AiFw will grow a per-subnet \"Accept DHCP relay\" toggle + trusted-relay-agent list editor. That's on the AiFw side; this issue only covers rDHCP.

## Acceptance criteria

- [ ] On FreeBSD, a DHCPDISCOVER arriving as unicast to the server IP with \`giaddr != 0\` is received and logged
- [ ] Scope selection via \`giaddr\` works (existing \`scope_for(giaddr)\` path exercised)
- [ ] OFFER/ACK are unicast back to \`giaddr:67\` via kernel UDP (not BPF)
- [ ] Direct-broadcast DHCP (\`giaddr == 0\`) continues to work unchanged
- [ ] \`trusted_relays\` whitelist enforces source-IP match when populated; drops with metric when not
- [ ] \`accept_relayed = false\` drops all relayed packets early
- [ ] Integration test: simulated relay client gets a lease from the correct scope
- [ ] \`bench/run.sh\` shows no regression in direct-broadcast throughput
- [ ] \`SECURITY.md\` updated with the trusted-relay model

## Repro

1. Any DHCP relay agent (Juniper \`forwarding-options dhcp-relay\`, ISC \`dhcrelay\`, Linux \`dhcp-helper\`) pointed at an rdhcpd server on FreeBSD
2. Configure a \`[[subnet]]\` on the server matching the relay's egress interface
3. Client DHCPs — currently no reply; server log shows no packet received despite tcpdump confirming arrival at the NIC

## Related

- \`src/main.rs\` lines 323–346 — FreeBSD bind block
- \`src/dhcpv4/server.rs\` lines 688–702, 881–895 — existing relay-aware handler paths (ready to go once packets can reach them)
- RFC 2131 §4.1 (client/server interaction), RFC 1542 §4 (BOOTP relay), RFC 3046 (Option 82)
